{
  "schema_version": 1,
  "program_id": "hepta-glasses-external-closure-v1",
  "candidate_identity_rule": "Every accepted packet binds the live convergence pull-request head commit, Git tree, canonical workflow run, exact-head source Artifact, and any applicable binary, provider, firmware, device, registry, and review identities. Any movement reopens the affected gate.",
  "claim_ceiling": "This program proves source-side preparation and enumerates authentic closure transactions. It does not close an Administration, provider, KMS/HSM, attestation, physical-device, firmware-vendor, independent-assurance, signing, pilot, rollout, rollback, store, or release gate without evidence issued and accepted by the named external authority.",
  "terminal_blocking_statuses": [
    "BLOCKED_ADMIN_SETTING",
    "BLOCKED_EXTERNAL",
    "BLOCKED_UPSTREAM"
  ],
  "gates": [
    {
      "id": "main-protection-and-adoption",
      "gap_ids": ["HG-0017", "HG-0089"],
      "issue_numbers": [84, 102],
      "authority_class": "repository_administrator_and_independent_api_observer",
      "status": "BLOCKED_ADMIN_SETTING",
      "owner": "Repository administrator plus a distinct governance observer",
      "source_preparation": [
        "contracts/main-branch-protection-v1.json",
        "tools/repository_governance.py",
        "docs/operations/REPOSITORY_GOVERNANCE_RUNBOOK.md"
      ],
      "evidence_required": [
        "Administration-authorized apply receipt for every canonical protection field",
        "Distinct complete sanitized API readback showing all seven exact required checks with strict=true",
        "Ordinary protected merge receipt and fresh exact-main seven-job CI plus Artifact verification"
      ],
      "acceptance": [
        "Every field in contracts/main-branch-protection-v1.json matches the live readback",
        "No bypass actor, direct ref update, force push, review dismissal, or temporary relaxation was used",
        "The adopted main commit and tree receive new exact-main evidence"
      ],
      "prohibited_substitutes": [
        "protected=true alone",
        "screenshots without a complete API payload",
        "repository-role admin without an Administration-capable API credential",
        "administrator bypass or direct main ref movement"
      ],
      "reopens_on": [
        "protection or ruleset movement",
        "required-check identity movement",
        "source, base, review, or main movement"
      ]
    },
    {
      "id": "out-of-band-authority-registry",
      "gap_ids": ["G10-TRUST-REGISTRY"],
      "issue_numbers": [96],
      "authority_class": "independent_trust_registry_controller",
      "status": "BLOCKED_EXTERNAL",
      "owner": "Independent release-security or assurance controller",
      "source_preparation": [
        "schemas/external-authority-trust-registry.schema.json",
        "tools/validate_external_evidence.py",
        "evidence/external/README.md"
      ],
      "evidence_required": [
        "Out-of-band authoritative registry digest and revision history",
        "Narrow Ed25519 authority seats with identity verification and proof of private-key possession",
        "Witnessed rotation, revocation, expiry, substitution, and cross-class negative drills"
      ],
      "acceptance": [
        "The registry digest is distributed outside repository and evidence-bundle custody",
        "No private key enters source, Actions, issues, pull requests, logs, or evidence packages",
        "Complete external evidence validates under the independently pinned registry"
      ],
      "prohibited_substitutes": [
        "repository-generated trust root",
        "pin derived from the submitted bundle",
        "one key reused for incompatible authority classes",
        "self-review or self-issued independence assertion"
      ],
      "reopens_on": [
        "registry revision, key, scope, status, or pin movement",
        "loss of proof-of-possession or controller independence"
      ]
    },
    {
      "id": "authenticated-independent-review",
      "gap_ids": ["HG-0044"],
      "issue_numbers": [85],
      "authority_class": "independent_code_reviewer_and_external_acceptance_reviewer",
      "status": "BLOCKED_EXTERNAL",
      "owner": "Eligible non-pusher Code Owner plus distinct external acceptance reviewer",
      "source_preparation": [
        "docs/development/G10_AUTHORITY_QUORUM_AND_REVIEW_INTEGRITY.md",
        "tools/validate_external_evidence.py",
        "contracts/external-evidence-envelope-v1.json"
      ],
      "evidence_required": [
        "Fresh exact-head GitHub approval by an eligible non-pusher",
        "Externally signed review statement binding head, tree, run, Artifact, review ID, and resolved conversations",
        "Distinct later acceptance bound to the final reviewer roster and acceptance context"
      ],
      "acceptance": [
        "Reviewer eligibility and independence satisfy the authority contract",
        "No source or base movement occurred after approval",
        "The signed package validates under the out-of-band registry"
      ],
      "prohibited_substitutes": [
        "stale approval",
        "author or latest-pusher approval",
        "unsigned issue comment",
        "repository-generated reviewer key"
      ],
      "reopens_on": [
        "source, base, workflow, Artifact, conversation, or reviewer-set movement"
      ]
    },
    {
      "id": "provider-credential-incident",
      "gap_ids": ["HG-0013"],
      "issue_numbers": [86],
      "authority_class": "credential_provider_and_security_incident_owner",
      "status": "BLOCKED_EXTERNAL",
      "owner": "Affected credential provider and named security incident owner",
      "source_preparation": [
        "docs/operations/CREDENTIAL_INCIDENT_RUNBOOK.md",
        "contracts/external-evidence-envelope-v1.json",
        "docs/THREAT_MODEL.md"
      ],
      "evidence_required": [
        "Provider-side historical credential revocation receipt and authoritative timestamp",
        "Negative-use proof that the old credential is unusable",
        "Replacement opaque KID/reference, scoped policy, incident timeline, and closure approval"
      ],
      "acceptance": [
        "The provider and incident owner sign the class-scoped claims",
        "No raw credential or replacement secret is disclosed",
        "Mobile and source artifacts contain no permanent provider credential"
      ],
      "prohibited_substitutes": [
        "deleting a key from source",
        "rotating a local environment variable",
        "masked dashboard screenshot",
        "assertion that the key is unused"
      ],
      "reopens_on": [
        "credential, tenant, scope, provider, environment, or incident finding movement"
      ]
    },
    {
      "id": "production-model-provider",
      "gap_ids": ["HG-0014"],
      "issue_numbers": [87],
      "authority_class": "production_model_tenant_owner_and_cloud_security",
      "status": "BLOCKED_EXTERNAL",
      "owner": "AI platform owner and cloud security owner",
      "source_preparation": [
        "docs/development/DURABLE_MODEL_GATEWAY.md",
        "docs/operations/DURABLE_MODEL_GATEWAY_RUNBOOK.md",
        "services/model_gateway/production.py"
      ],
      "evidence_required": [
        "Production tenant, deployment, model, region, quota, retention, and training-use policy exports",
        "KMS or secret-manager reference and redacted live success, rejection, timeout, cancel, quota, and revoke receipts",
        "Independent confirmation that permanent provider secrets are absent from mobile binaries"
      ],
      "acceptance": [
        "Live receipts bind to the declared tenant, deployment, candidate, and policy",
        "Cancellation, deadline, rate, abuse, retention, and failure-closed controls are exercised",
        "Artifact digests and owner approvals validate under the external registry"
      ],
      "prohibited_substitutes": [
        "loopback gateway",
        "mock or test tenant",
        "source unit tests",
        "synthetic provider receipt"
      ],
      "reopens_on": [
        "tenant, model, region, credential, quota, retention, deployment, or provider movement"
      ]
    },
    {
      "id": "production-identity-kms-attestation",
      "gap_ids": ["HG-0015"],
      "issue_numbers": [88],
      "authority_class": "kms_hsm_owner_platform_attestation_owner_and_cloud_security",
      "status": "BLOCKED_EXTERNAL",
      "owner": "KMS/HSM administrator, Android and Apple attestation owners, and cloud security",
      "source_preparation": [
        "docs/development/DURABLE_IDENTITY.md",
        "docs/operations/IDENTITY_AUTHORITY_RUNBOOK.md",
        "contracts/identity-authority-v1.json"
      ],
      "evidence_required": [
        "Production KMS/HSM key metadata, non-export policy, opaque KIDs, and deployment identity",
        "Android and Apple attestation receipts bound to nonce, package or bundle, signer, device, freshness, and verdict policy",
        "Rotation, revocation, replay, lost-device containment, and recovery drill receipts"
      ],
      "acceptance": [
        "Private material remains non-exportable and outside source/mobile custody",
        "Attestation receipts bind to the exact production applications and candidate",
        "Independent assurance accepts rotation, revoke, replay, loss, and recovery behavior"
      ],
      "prohibited_substitutes": [
        "development HMAC key",
        "software-only mock KMS",
        "simulator attestation",
        "local certificate or screenshot without issuer receipt"
      ],
      "reopens_on": [
        "key, policy, region, application identity, signer, attestation policy, or recovery movement"
      ]
    },
    {
      "id": "production-realtime-oauth",
      "gap_ids": ["HG-0021"],
      "issue_numbers": [89],
      "authority_class": "realtime_provider_tenant_owner_and_oauth_registration_owner",